{
  "id": "drks00000000",
  "name": "Full official trial title",
  "acronym": null,
  "plain_summary": "Plain-language 1–2 sentences for patients: what is tested, on whom, how (e.g. 'Tests whether X, a drug that …, eases fatigue after COVID, compared with a placebo.').",
  "key_requirement": "Most important entry requirement in a few words.",
  "status": "recruiting",
  "open_for_enrollment": true,
  "intervention": {
    "name": "Drug / intervention name",
    "type": "drug",
    "mechanism": "One-line mechanism of action."
  },
  "is_drug_study": true,
  "associated_researchers": [],
  "priority": "normal",
  "sponsor": null,
  "principal_investigator": null,
  "germany": {
    "has_german_site": true,
    "sites": [
      { "institution": "", "city": "", "recruiting": true }
    ]
  },
  "condition": "ME/CFS",
  "phase": null,
  "eligibility": {
    "summary": "",
    "key_inclusion": [],
    "key_exclusion": [],
    "age": "",
    "sex": ""
  },
  "registry": {
    "name": "DRKS",
    "id": "DRKS00000000",
    "url": "https://drks.de/search/de/trial/DRKS00000000"
  },
  "links": [],
  "first_seen": "YYYY-MM-DD",
  "last_checked": "YYYY-MM-DD",
  "last_status_change": null,
  "status_history": [
    { "date": "YYYY-MM-DD", "status": "recruiting" }
  ],
  "flags": ["new"],
  "relevance": {
    "me_cfs": true,
    "germany": true,
    "open_enrollment": true,
    "drug_study": true,
    "wirth_or_scheibenbogen": false
  },
  "notes": ""
}
